<?xml version="1.0" encoding="UTF-8"?>
<d1:listObjects xmlns:d1="http://dataone.org/service/types/ListObjects/0.1"
 xmlns:common="http://dataone.org/service/types/common/0.1"
 xmlns:xsi="http://www.w3.org/2001/XMLSchema-instance"
 xsi:schemaLocation="http://dataone.org/service/types/ListObjects/0.1 file:/home/rwaltz/Projects/NetBeans/DataONE-CnPrototype/DataONE-CnDomain/src/main/resources/org/dataone/service/resources/schema/listobjects.xsd" 
 count="2" start="0" total="2">
    <objectInfo>
        <identifier>ABC123</identifier>
        <objectFormat>eml://ecoinformatics.org/eml-2.0.0</objectFormat>
        <checksum algorithm="SHA-1">SGVsbG8gV29ybGQh</checksum>
        <dateSysMetadataModified>2006-05-04T18:13:51.0Z</dateSysMetadataModified>
        <size>922337203</size>
    </objectInfo>
    <objectInfo>
        <identifier>ABC456</identifier>
        <objectFormat>eml://ecoinformatics.org/eml-2.0.0</objectFormat>
        <checksum algorithm="SHA-1">V29ybGQgSGVsbG8h</checksum>
        <dateSysMetadataModified>2006-05-05T18:13:51.0Z</dateSysMetadataModified>
        <size>922337203</size>
    </objectInfo>
</d1:listObjects>
